{
  "$schema" : "https://vibedeck-schema.alanreisanjo.workers.dev/v1/command.schema.json",
  "argumentHint" : "<issue do GitHub, ex.: #12>",
  "author" : "ai",
  "createdAt" : "2026-10-08T14:34:34Z",
  "id" : "F93F4B15-E82C-46D7-8CB9-B7152170FF84",
  "model" : "sonnet",
  "prompt" : "Você vai buscar uma **issue do GitHub** (`Hoyasumii/vibedeck`) e registrá-la como a task desta execução, sem\nimplementar nada. É a 1ª etapa do workflow **Conduzir**: diz se a task começa do zero ou se já tem PR\npublicado.\n\n- **Entrada**: $ARGUMENTS — `#12` ou `12` (o número da issue). Qualquer outra coisa (vazio, texto, mais de um\n  número) → PARE e diga que o formato esperado é o número da issue.\n- **Pasta da task**: `$RUN_DIR` (fora de um workflow: `.vibedeck/runs/conduzir/<N>/`). Branch: `issue-<N>`.\n  Base: `main`.\n\n## 1. Buscar\n```bash\ngh issue view <N> --repo Hoyasumii/vibedeck --json number,title,body,url,state,labels,assignees,projectItems,updatedAt\n```\nFalhou (issue inexistente, sem autenticação) → PARE e mostre o erro, sem gravar nada. Issue fechada → PARE e\ndiga que ela está fechada (reabrir é decisão do usuário).\n\n**Só issue atribuída a quem roda** (como o `/conduzir` do claude-kit): `gh api user --jq .login` precisa\nestar em `assignees`. Não está → PARE: diga quem são os responsáveis (ou que não há nenhum) e que é preciso\nse atribuir (`gh issue edit <N> --add-assignee @me`) e rodar de novo.\n\n## 2. Registrar\nGrave `$RUN_DIR/task.md` (crie a pasta se preciso). Já existe → reescreva e acrescente uma linha ao\n`## Histórico` dizendo o que mudou (título, corpo).\n\n```markdown\n---\nissue: <N>\nurl: <url>\ntitulo: <title>\natualizadoEm: <updatedAt>\nprojeto: <título do projeto em projectItems, ou nenhum>\nstatus: <status.name, ou nenhum>\nlabels: [<nomes>]\n---\n# #<N> — <title>\n\n<body exatamente como veio: sem resumir, traduzir nem reformatar>\n\n## Issues citadas\n- #<M> — <title> (<state>)   ← uma por `#M` citado no corpo; `gh issue view <M> --json title,state,body`\n\n## Histórico\n- AAAA-MM-DD: registrada\n```\n\nImagens no corpo (`![…](https://…)`): baixe com `gh api` ou `curl -L` para o seu diretório de rascunho, leia\ncom a ferramenta de leitura e troque cada uma, no `task.md`, por `[imagem n: <descrição literal do que ela\nmostra>]`. Descreva, não interprete. Não deu para ler → `[imagem n: não foi possível ler (<erro>)]`.\n\nIssues citadas: só um nível (as citadas das citadas não). Uma que falhar não impede o registro: anote o erro.\n\n## 3. Projeto\nSiga a skill **status-no-github-project** do VibeDeck (`vibedeck skills show status-no-github-project`). Issue\nfora de qualquer projeto → adicione ao projeto (a skill diz como escolher).\n\n## 4. Veredito\n- Corpo vazio (só espaços) → mude o Status para `Para refinar` (skill) e comente na issue:\n  ```markdown\n  ## Triagem: issue sem descrição\n  **Motivo:** a issue não tem descrição, então não há enunciado nem definições de pronto para avaliar e implementar.\n\n  **O que destrava:** escrever a descrição com o objetivo, as regras e as definições de pronto (critérios de aceite). Depois disso, rode o workflow de novo.\n  ```\n  Veredito `SEM_DESCRICAO`.\n- Já existe PR da branch `issue-<N>` (`gh pr list --repo Hoyasumii/vibedeck --head issue-<N> --state open --json number,url`)\n  e `$RUN_DIR/avaliacoes/` tem uma avaliação RESOLVIDA → veredito `COM_PR` (o ciclo segue buscando o review).\n- Senão → veredito `REGISTRADA`.\n\n## Saída\n- Issue (número, título, URL), projeto e Status\n- O que mudou no registro (se já existia)\n- Issues citadas registradas e as que falharam\n- Imagens descritas e as que falharam\n- **Última linha, sozinha:** `REGISTRADA`, `COM_PR` ou `SEM_DESCRICAO`",
  "summary" : "Busca a issue do GitHub e a registra na pasta da execução; diz se a task começa do zero ou já tem PR",
  "tags" : [
    "claude-kit",
    "conduzir"
  ],
  "title" : "Registrar task do GitHub",
  "updatedAt" : "2026-10-08T14:34:34Z"
}
