{
  "$schema" : "https://vibedeck-schema.alanreisanjo.workers.dev/v1/command.schema.json",
  "argumentHint" : "<issue do GitHub, ex.: #12>",
  "author" : "ai",
  "createdAt" : "2026-10-08T14:34:34Z",
  "id" : "7FDA5B82-A1A0-4F51-8850-431F2C1D4CB9",
  "model" : "sonnet",
  "prompt" : "Você vai publicar o PR de uma Task que passou pelo ciclo `planejar → criticar → implementar → avaliar` e foi\navaliada **RESOLVIDA**. É a etapa `abrir-pull-request` do workflow **Conduzir**. Este comando não altera\ncódigo, não faz checkout, `stash`, `reset`, `rebase` nem `merge`.\n\n**Rodar o workflow autoriza**, sem pedir confirmação: o push da branch `issue-<N>` (`git push -u origin\nissue-<N>`, **nunca** `--force`); criar ou editar o PR dessa branch e atribuí-lo a `@me`; comentar na issue\ne mudar o Status dela para `Review`; responder o review atendido (fios do PR, comentário geral, novo pedido\nde review).\n\n- **Entrada**: $ARGUMENTS (número da issue). **Pasta da task**: `$RUN_DIR` (fora de um workflow:\n  `.vibedeck/runs/conduzir/<N>/`).\n\n## 1. Portões\nNa ordem; falhou → PARE e diga qual etapa rodar:\n1. `task.md` existe.\n2. O último plano tem `.critica.md` APROVADO e `.implementacao.md`.\n3. A última avaliação é RESOLVIDA, com `commitAvaliado` igual a `git rev-parse issue-<N>` e\n   `taskAtualizadoEm` igual ao do `task.md`.\n4. `$RUN_DIR/README.md` existe, com título (`# `) e `## Objetivo`.\n\nTítulo do PR: a linha `# ` do README (sem o `# `). Corpo: o README sem a linha do título, num arquivo\ntemporário do seu diretório de rascunho.\n\n**Reviews a responder**: os `reviews/*.resumo.md` listados em `reviewsAtendidas` da última avaliação e sem a\nlinha `- Respondido em:`.\n\n## 2. Repositório (só leitura)\n- `git fetch origin`; `git log --oneline origin/<base>..issue-<N>` e `git diff --stat origin/<base>...issue-<N>`.\n- `git merge-base --is-ancestor <baseCommit do primeiro plano> origin/<base>`. Não é ancestral → a branch\n  carrega commits que não são da task: PARE e pergunte ao usuário como seguir.\n\n## 3. Push\n`git push -u origin issue-<N>`. Rejeitado → PARE, mostre o erro e não abra o PR.\n\n## 4. PR\n`gh pr list --repo Hoyasumii/vibedeck --head issue-<N> --state open --json number,url,baseRefName,assignees`\n- Nenhum aberto → `gh pr create --repo Hoyasumii/vibedeck --base <base> --head issue-<N> --title \"<título>\"\n  --body-file <arquivo> --assignee @me`.\n- Já existe → `gh pr edit <número> --title … --body-file …` (e `--base <base>` se mudou; `--add-assignee @me`\n  se você não está).\n- `gh pr checks <número>` só como informação.\n\n## 5. Responder o review (só com reviews a responder)\nFonte: a tabela \"Reviews atendidas\" do README. HEAD curto: `git rev-parse --short issue-<N>`.\n1. Fio de cada comentário inline (origem `github:review-comment:<id> (fio <fio>)`) →\n   `gh api repos/Hoyasumii/vibedeck/pulls/<número>/comments/<fio>/replies -f body=\"<o que foi feito> (<HEAD curto>)\"`.\n2. Comentário geral: `gh pr comment <número> --body-file <arquivo>` com `Review atendido em <HEAD curto>:` e\n   a tabela.\n3. Pedir o review de novo aos logins das origens `github:` → `gh pr edit <número> --add-reviewer <logins>`.\n4. Marque cada resumo: abaixo de `- Registrado em:`, `- Respondido em: AAAA-MM-DD (PR #<número>)`.\nFalha numa resposta não desfaz push nem PR: mostre o que ficou por publicar e não marque o resumo.\n\n## 6. Issue e projeto\n- Comente na issue `Pull request aberto: <url>` (ou `atualizado`), se a URL ainda não estiver nos comentários\n  (`gh issue view <N> --comments`).\n- Status `Review` (skill **status-no-github-project**).\nFalha aqui não desfaz push nem PR: mostre o que fazer à mão.\n\n## Saída final\n- PR **criado** ou **atualizado**: número, URL, base, título\n- Push, commits do PR e `--stat`; checks do CI\n- Review respondido (se houve); comentário e Status da issue\n- **Última linha, sozinha:** `PR_PUBLICADO`",
  "summary" : "Envia a branch, abre ou atualiza o PR, responde o review atendido e move a issue para Review",
  "tags" : [
    "claude-kit",
    "conduzir"
  ],
  "title" : "Abrir pull request",
  "updatedAt" : "2026-10-08T14:34:34Z"
}
